{"cod_dpto": "99", "dpto": "VICHADA", "n_contratos": 9440, "valor_total": 433481888942.0, "score_promedio": 4.753595165703958, "n_bajo": 9161, "n_medio": 268, "n_alto": 11, "n_criticos": 0, "municipios": [{"cod_mpio": "99001", "municipio": "PUERTO CARREÑO", "n_contratos": 9428, "valor_total": 432142999041.0, "score": 4.767634670365934, "tier": "bajo", "datos_insuficientes": false}, {"cod_mpio": "99624", "municipio": "SANTA ROSALÍA", "n_contratos": 12, "valor_total": 1338889901.0, "score": 2.2792894088219526, "tier": "bajo", "datos_insuficientes": false}], "top_entidades": [{"nit_entidad": "842000015", "nombre_entidad": "DEPARTAMENTO DE POLICIA VICHADA", "cod_dpto": "99", "dpto": "VICHADA", "n_contratos": 365, "valor_total": 26867309635.0, "score": 12.747142106818307, "tier": "bajo", "datos_insuficientes": false, "n_flags_aplicables": 2, "n_flags_disparados": 1, "banderas": [{"flag_id": "F12", "nombre": "Concentración/dependencia", "peso": 8, "evidence": {"anio": 2018, "doc_proveedor_dominante": "4237991", "n_contratos_entidad_anual": 36, "participacion_proveedor_en_entidad": 0.8723840023851911, "condicion_a_captura_entidad": true, "n_contratos_proveedor_anual": 4, "dependencia_proveedor_en_entidad": 0.9858975500838876, "condicion_b_dependencia_proveedor": false}}]}, {"nit_entidad": "800141684", "nombre_entidad": "ARMADA NACIONAL - BASE NAVAL ARC ORINOQUIA", "cod_dpto": "99", "dpto": "VICHADA", "n_contratos": 413, "valor_total": 58093643897.0, "score": 10.045219765763518, "tier": "bajo", "datos_insuficientes": false, "n_flags_aplicables": 2, "n_flags_disparados": 1, "banderas": [{"flag_id": "F12", "nombre": "Concentración/dependencia", "peso": 8, "evidence": {"anio": 2020, "doc_proveedor_dominante": "9007087138", "n_contratos_entidad_anual": 47, "participacion_proveedor_en_entidad": 0.21829315575098054, "condicion_a_captura_entidad": false, "n_contratos_proveedor_anual": 9, "dependencia_proveedor_en_entidad": 0.8154340579590207, "condicion_b_dependencia_proveedor": true}}]}, {"nit_entidad": "842000004", "nombre_entidad": "HOSPITAL DEPARTAMENTAL SAN JUAN DE DIOS DE PUERTO CARREÑO1", "cod_dpto": "99", "dpto": "VICHADA", "n_contratos": 6186, "valor_total": 153083844638.0, "score": 9.740825829570106, "tier": "bajo", "datos_insuficientes": false, "n_flags_aplicables": 2, "n_flags_disparados": 1, "banderas": [{"flag_id": "F12", "nombre": "Concentración/dependencia", "peso": 8, "evidence": {"anio": 2026, "doc_proveedor_dominante": "901437563", "n_contratos_entidad_anual": 1729, "participacion_proveedor_en_entidad": 0.0676345307954865, "condicion_a_captura_entidad": false, "n_contratos_proveedor_anual": 7, "dependencia_proveedor_en_entidad": 1.0, "condicion_b_dependencia_proveedor": true}}]}, {"nit_entidad": "842000005", "nombre_entidad": "BATALLON DE ASPC N° 28", "cod_dpto": "99", "dpto": "VICHADA", "n_contratos": 227, "valor_total": 13580123663.0, "score": 9.69589814972177, "tier": "bajo", "datos_insuficientes": false, "n_flags_aplicables": 2, "n_flags_disparados": 0, "banderas": []}, {"nit_entidad": "892099305", "nombre_entidad": "Municipio de Puerto Carreño Vichada", "cod_dpto": "99", "dpto": "VICHADA", "n_contratos": 64, "valor_total": 2639121687.0, "score": 8.644423507792645, "tier": "bajo", "datos_insuficientes": false, "n_flags_aplicables": 2, "n_flags_disparados": 1, "banderas": [{"flag_id": "F12", "nombre": "Concentración/dependencia", "peso": 8, "evidence": {"anio": 2019, "doc_proveedor_dominante": "900857485", "n_contratos_entidad_anual": 58, "participacion_proveedor_en_entidad": 0.7337765669920884, "condicion_a_captura_entidad": true, "n_contratos_proveedor_anual": 1, "dependencia_proveedor_en_entidad": 1.0, "condicion_b_dependencia_proveedor": false}}]}, {"nit_entidad": "800103318", "nombre_entidad": "ALCALDIA MUNICIPAL DE SANTA ROSALIA", "cod_dpto": "99", "dpto": "VICHADA", "n_contratos": 3, "valor_total": 1267422000.0, "score": 7.749348865146097, "tier": "bajo", "datos_insuficientes": true, "n_flags_aplicables": 0, "n_flags_disparados": 0, "banderas": []}, {"nit_entidad": "900584254", "nombre_entidad": "PERSONERIA PUERTO CARREÑO", "cod_dpto": "99", "dpto": "VICHADA", "n_contratos": 7, "valor_total": 211101750.0, "score": 5.89464459377779, "tier": "bajo", "datos_insuficientes": true, "n_flags_aplicables": 1, "n_flags_disparados": 0, "banderas": []}, {"nit_entidad": "901552719", "nombre_entidad": "PERSONERIA MUNICIPAL DE SANTA ROSALIA VICHADA", "cod_dpto": "99", "dpto": "VICHADA", "n_contratos": 9, "valor_total": 71467901.0, "score": 5.6599393726370355, "tier": "bajo", "datos_insuficientes": true, "n_flags_aplicables": 1, "n_flags_disparados": 0, "banderas": []}, {"nit_entidad": "832000034", "nombre_entidad": "CONTRALORIA DEPARTAMENTAL DEL VICHADA", "cod_dpto": "99", "dpto": "VICHADA", "n_contratos": 121, "valor_total": 1192064296.0, "score": 2.504803764798819, "tier": "bajo", "datos_insuficientes": false, "n_flags_aplicables": 2, "n_flags_disparados": 0, "banderas": []}], "serie_anio": [{"anio": 2017, "n_contratos": 13, "valor_total": 186113882.0, "score_promedio": 7.127315685544566}, {"anio": 2018, "n_contratos": 115, "valor_total": 14777006546.0, "score_promedio": 3.4963365148877292}, {"anio": 2019, "n_contratos": 198, "valor_total": 13152365707.0, "score_promedio": 5.8962499053980295}, {"anio": 2020, "n_contratos": 359, "valor_total": 31647401989.0, "score_promedio": 4.953710224718053}, {"anio": 2021, "n_contratos": 362, "valor_total": 31485660412.0, "score_promedio": 7.532733199076464}, {"anio": 2022, "n_contratos": 1621, "valor_total": 44496092255.0, "score_promedio": 4.530344852002421}, {"anio": 2023, "n_contratos": 2770, "valor_total": 91505109408.0, "score_promedio": 7.341183877825152}, {"anio": 2024, "n_contratos": 626, "valor_total": 64787193519.0, "score_promedio": 2.3084503066209323}, {"anio": 2025, "n_contratos": 1315, "valor_total": 87288654715.0, "score_promedio": 3.751372446074224}, {"anio": 2026, "n_contratos": 2061, "valor_total": 54156290509.0, "score_promedio": 3.4301095834529964}]}