{"cod_dpto": "95", "dpto": "GUAVIARE", "n_contratos": 3684, "valor_total": 294646628718.0, "score_promedio": 6.8708672754140805, "n_bajo": 3533, "n_medio": 135, "n_alto": 13, "n_criticos": 3, "municipios": [{"cod_mpio": "95200", "municipio": "MIRAFLORES", "n_contratos": 432, "valor_total": 24845653828.0, "score": 17.18629176557456, "tier": "bajo", "datos_insuficientes": false}, {"cod_mpio": "95001", "municipio": "SAN JOSÉ DEL GUAVIARE", "n_contratos": 3252, "valor_total": 269800974890.0, "score": 5.901922283366853, "tier": "bajo", "datos_insuficientes": false}], "top_entidades": [{"nit_entidad": "800103198", "nombre_entidad": "MUNICIPIO DE MIRAFLORES GUAVIARE", "cod_dpto": "95", "dpto": "GUAVIARE", "n_contratos": 430, "valor_total": 24814325680.0, "score": 27.07817542724699, "tier": "medio", "datos_insuficientes": false, "n_flags_aplicables": 1, "n_flags_disparados": 1, "banderas": [{"flag_id": "F12", "nombre": "Concentración/dependencia", "peso": 8, "evidence": {"anio": 2025, "doc_proveedor_dominante": "901264485", "n_contratos_entidad_anual": 213, "participacion_proveedor_en_entidad": 0.0978116005329476, "condicion_a_captura_entidad": false, "n_contratos_proveedor_anual": 16, "dependencia_proveedor_en_entidad": 1.0, "condicion_b_dependencia_proveedor": true}}]}, {"nit_entidad": "800252722", "nombre_entidad": "DEPARTAMENTO DE POLICÍA GUAVIARE", "cod_dpto": "95", "dpto": "GUAVIARE", "n_contratos": 221, "valor_total": 17310690196.0, "score": 22.942670382325172, "tier": "medio", "datos_insuficientes": false, "n_flags_aplicables": 1, "n_flags_disparados": 1, "banderas": [{"flag_id": "F12", "nombre": "Concentración/dependencia", "peso": 8, "evidence": {"anio": 2026, "doc_proveedor_dominante": "901429186", "n_contratos_entidad_anual": 13, "participacion_proveedor_en_entidad": 0.597965476755884, "condicion_a_captura_entidad": true, "n_contratos_proveedor_anual": 3, "dependencia_proveedor_en_entidad": 0.48374044657575305, "condicion_b_dependencia_proveedor": false}}]}, {"nit_entidad": "800103180", "nombre_entidad": "ALCALDÍA MUNICIPAL DE SAN JOSÉ DEL GUAVIARE", "cod_dpto": "95", "dpto": "GUAVIARE", "n_contratos": 47, "valor_total": 10081194464.0, "score": 20.162136943750557, "tier": "medio", "datos_insuficientes": false, "n_flags_aplicables": 1, "n_flags_disparados": 1, "banderas": [{"flag_id": "F12", "nombre": "Concentración/dependencia", "peso": 8, "evidence": {"anio": 2025, "doc_proveedor_dominante": "830128504", "n_contratos_entidad_anual": 8, "participacion_proveedor_en_entidad": 0.5960634613930632, "condicion_a_captura_entidad": true, "n_contratos_proveedor_anual": 8, "dependencia_proveedor_en_entidad": 0.217666754508157, "condicion_b_dependencia_proveedor": false}}]}, {"nit_entidad": "8320008258", "nombre_entidad": "INSTITUTO DEPARTAMENTAL DEL DEPORTE Y LA RECREACION, EL APROVECHAMIENTO  DEL TIEMPO LIBRE  Y LA EDUCACION EXTRAESCOLAR DEL GUAVIARE - SITIO OFICIAL", "cod_dpto": "95", "dpto": "GUAVIARE", "n_contratos": 2, "valor_total": 291783490.0, "score": 17.084473370656884, "tier": "bajo", "datos_insuficientes": true, "n_flags_aplicables": 0, "n_flags_disparados": 0, "banderas": []}, {"nit_entidad": "8001031984", "nombre_entidad": "CONCEJO DE MIRAFLORES GUAVIARE", "cod_dpto": "95", "dpto": "GUAVIARE", "n_contratos": 2, "valor_total": 31328148.0, "score": 17.084473370656884, "tier": "bajo", "datos_insuficientes": true, "n_flags_aplicables": 0, "n_flags_disparados": 0, "banderas": []}, {"nit_entidad": "900364348", "nombre_entidad": "BATALLÓN DE APOYO Y SERVICIOS PARA EL COMBATE No 22", "cod_dpto": "95", "dpto": "GUAVIARE", "n_contratos": 223, "valor_total": 12121173821.0, "score": 4.678242051756566, "tier": "bajo", "datos_insuficientes": false, "n_flags_aplicables": 1, "n_flags_disparados": 0, "banderas": []}], "serie_anio": [{"anio": 2017, "n_contratos": 13, "valor_total": 792054867.0, "score_promedio": 12.1215048507531}, {"anio": 2018, "n_contratos": 71, "valor_total": 5022885789.0, "score_promedio": 10.207989225970556}, {"anio": 2019, "n_contratos": 67, "valor_total": 6236902929.0, "score_promedio": 10.532304968905034}, {"anio": 2020, "n_contratos": 399, "valor_total": 31132124015.0, "score_promedio": 4.473125697957895}, {"anio": 2021, "n_contratos": 418, "valor_total": 37535361237.0, "score_promedio": 5.183336996933036}, {"anio": 2022, "n_contratos": 369, "valor_total": 28699055018.0, "score_promedio": 5.657010602955983}, {"anio": 2023, "n_contratos": 474, "valor_total": 40522532767.0, "score_promedio": 4.542593975737104}, {"anio": 2024, "n_contratos": 644, "valor_total": 43640742875.0, "score_promedio": 5.985800830474996}, {"anio": 2025, "n_contratos": 746, "valor_total": 74208273602.0, "score_promedio": 10.891331004823432}, {"anio": 2026, "n_contratos": 483, "valor_total": 26856695619.0, "score_promedio": 5.518854150043777}]}