{"cod_dpto": "11", "dpto": "BOGOTÁ, D.C.", "n_contratos": 8, "valor_total": 3600000000.0, "score_promedio": 60.111111111111114, "n_bajo": 1, "n_medio": 2, "n_alto": 2, "n_criticos": 3, "municipios": [{"cod_mpio": "11001", "municipio": "BOGOTÁ, D.C.", "n_contratos": 8, "valor_total": 3600000000.0, "score": 49.5, "tier": "alto", "datos_insuficientes": true}], "top_entidades": [{"nit_entidad": "900111003", "nombre_entidad": "ALCALDÍA DE BOGOTÁ", "cod_dpto": "11", "dpto": "BOGOTÁ, D.C.", "n_contratos": 15, "valor_total": 3600000000.0, "score": 49.5, "tier": "alto", "datos_insuficientes": false, "n_flags_aplicables": 5, "n_flags_disparados": 2, "banderas": []}], "serie_anio": [{"anio": 2023, "n_contratos": 8, "valor_total": 3600000000.0, "score_promedio": 60.111111111111114}]}