{"cod_dpto": "05", "dpto": "ANTIOQUIA", "n_contratos": 18, "valor_total": 8950000000.0, "score_promedio": 46.76536312849162, "n_bajo": 6, "n_medio": 4, "n_alto": 2, "n_criticos": 6, "municipios": [{"cod_mpio": "05001", "municipio": "MEDELLÍN", "n_contratos": 18, "valor_total": 8950000000.0, "score": 42.0, "tier": "alto", "datos_insuficientes": false}, {"cod_mpio": "05266", "municipio": "ENVIGADO", "n_contratos": 1, "valor_total": 0.0, "score": null, "tier": null, "datos_insuficientes": true}], "top_entidades": [{"nit_entidad": "900111001", "nombre_entidad": "ALCALDÍA DE MEDELLÍN", "cod_dpto": "05", "dpto": "ANTIOQUIA", "n_contratos": 12, "valor_total": 4250000000.0, "score": 46.77777777777778, "tier": "alto", "datos_insuficientes": false, "n_flags_aplicables": 5, "n_flags_disparados": 2, "banderas": []}, {"nit_entidad": "900111002", "nombre_entidad": "GOBERNACIÓN DE ANTIOQUIA", "cod_dpto": "05", "dpto": "ANTIOQUIA", "n_contratos": 9, "valor_total": 4700000000.0, "score": 37.22222222222222, "tier": "medio", "datos_insuficientes": true, "n_flags_aplicables": 5, "n_flags_disparados": 2, "banderas": []}], "serie_anio": [{"anio": 2021, "n_contratos": 9, "valor_total": 4250000000.0, "score_promedio": 56.62352941176471}, {"anio": 2022, "n_contratos": 9, "valor_total": 4700000000.0, "score_promedio": 37.851063829787236}]}