{"cod_dpto": "25", "dpto": "CUNDINAMARCA", "n_contratos": 8, "valor_total": 3800000000.0, "score_promedio": 48.78947368421053, "n_bajo": 3, "n_medio": 1, "n_alto": 2, "n_criticos": 2, "municipios": [{"cod_mpio": "25754", "municipio": "SOACHA", "n_contratos": 8, "valor_total": 3800000000.0, "score": 42.875, "tier": "alto", "datos_insuficientes": true}], "top_entidades": [{"nit_entidad": "900111006", "nombre_entidad": "ALCALDÍA DE SOACHA", "cod_dpto": "25", "dpto": "CUNDINAMARCA", "n_contratos": 1, "valor_total": 3800000000.0, "score": 42.875, "tier": "alto", "datos_insuficientes": true, "n_flags_aplicables": 5, "n_flags_disparados": 2, "banderas": []}], "serie_anio": [{"anio": 2023, "n_contratos": 8, "valor_total": 3800000000.0, "score_promedio": 48.78947368421053}]}