{"cod_dpto": "91", "dpto": "AMAZONAS", "n_contratos": 13509, "valor_total": 1016121611362.0, "score_promedio": 8.901576349020187, "n_bajo": 13061, "n_medio": 431, "n_alto": 14, "n_criticos": 3, "municipios": [{"cod_mpio": "91001", "municipio": "LETICIA", "n_contratos": 13509, "valor_total": 1016121611362.0, "score": 8.901576349020196, "tier": "bajo", "datos_insuficientes": false}], "top_entidades": [{"nit_entidad": "899999302", "nombre_entidad": "ALCALDIA MUNICIPIO DE LETICIA", "cod_dpto": "91", "dpto": "AMAZONAS", "n_contratos": 2390, "valor_total": 79648693828.0, "score": 17.24091969124185, "tier": "bajo", "datos_insuficientes": false, "n_flags_aplicables": 2, "n_flags_disparados": 1, "banderas": [{"flag_id": "F12", "nombre": "Concentración/dependencia", "peso": 8, "evidence": {"anio": 2025, "doc_proveedor_dominante": "838000082", "n_contratos_entidad_anual": 941, "participacion_proveedor_en_entidad": 0.12905000143384937, "condicion_a_captura_entidad": false, "n_contratos_proveedor_anual": 16, "dependencia_proveedor_en_entidad": 0.8732703766528541, "condicion_b_dependencia_proveedor": true}}]}, {"nit_entidad": "899999336", "nombre_entidad": "GOBERNACION DEL AMAZONAS", "cod_dpto": "91", "dpto": "AMAZONAS", "n_contratos": 7547, "valor_total": 554778703804.0, "score": 16.114212827914052, "tier": "bajo", "datos_insuficientes": false, "n_flags_aplicables": 2, "n_flags_disparados": 1, "banderas": [{"flag_id": "F12", "nombre": "Concentración/dependencia", "peso": 8, "evidence": {"anio": 2025, "doc_proveedor_dominante": "838000096", "n_contratos_entidad_anual": 2711, "participacion_proveedor_en_entidad": 0.2595092080275677, "condicion_a_captura_entidad": false, "n_contratos_proveedor_anual": 6, "dependencia_proveedor_en_entidad": 0.9770718783076126, "condicion_b_dependencia_proveedor": true}}]}, {"nit_entidad": "9003942121", "nombre_entidad": "INSTITUCION EDUCATIVA FRANCISCO DEL ROSARIO VELA", "cod_dpto": "91", "dpto": "AMAZONAS", "n_contratos": 10, "valor_total": 828654755.0, "score": 14.927298486254369, "tier": "bajo", "datos_insuficientes": false, "n_flags_aplicables": 2, "n_flags_disparados": 1, "banderas": [{"flag_id": "F12", "nombre": "Concentración/dependencia", "peso": 8, "evidence": {"anio": 2025, "doc_proveedor_dominante": "901573799", "n_contratos_entidad_anual": 6, "participacion_proveedor_en_entidad": 0.6118827596036563, "condicion_a_captura_entidad": true, "n_contratos_proveedor_anual": 35, "dependencia_proveedor_en_entidad": 0.13942200535459262, "condicion_b_dependencia_proveedor": false}}]}, {"nit_entidad": "800140601", "nombre_entidad": "DEPARTAMENTO DE POLICÍA AMAZONAS", "cod_dpto": "91", "dpto": "AMAZONAS", "n_contratos": 471, "valor_total": 23009628645.0, "score": 14.269475475758084, "tier": "bajo", "datos_insuficientes": false, "n_flags_aplicables": 2, "n_flags_disparados": 1, "banderas": [{"flag_id": "F12", "nombre": "Concentración/dependencia", "peso": 8, "evidence": {"anio": 2017, "doc_proveedor_dominante": "7546762", "n_contratos_entidad_anual": 10, "participacion_proveedor_en_entidad": 0.7732502786585067, "condicion_a_captura_entidad": true, "n_contratos_proveedor_anual": 1, "dependencia_proveedor_en_entidad": 1.0, "condicion_b_dependencia_proveedor": false}}]}, {"nit_entidad": "901544996", "nombre_entidad": "AMAZONAS DESARROLLO INTELIGENTE", "cod_dpto": "91", "dpto": "AMAZONAS", "n_contratos": 15, "valor_total": 6863113929.0, "score": 13.58312995592227, "tier": "bajo", "datos_insuficientes": false, "n_flags_aplicables": 2, "n_flags_disparados": 0, "banderas": []}, {"nit_entidad": "838000055", "nombre_entidad": "ARMADA NACIONAL - GRUPO GUARDACOSTAS DEL AMAZONAS", "cod_dpto": "91", "dpto": "AMAZONAS", "n_contratos": 177, "valor_total": 5803826629.0, "score": 11.161047732369537, "tier": "bajo", "datos_insuficientes": false, "n_flags_aplicables": 2, "n_flags_disparados": 1, "banderas": [{"flag_id": "F12", "nombre": "Concentración/dependencia", "peso": 8, "evidence": {"anio": 2026, "doc_proveedor_dominante": "900977741", "n_contratos_entidad_anual": 6, "participacion_proveedor_en_entidad": 0.6641391201435773, "condicion_a_captura_entidad": true, "n_contratos_proveedor_anual": 4, "dependencia_proveedor_en_entidad": 0.534243496781406, "condicion_b_dependencia_proveedor": false}}]}, {"nit_entidad": "8380002711", "nombre_entidad": "INSTITUCION EDUCATIVA SAGRADO CORAZON DE JESUS1", "cod_dpto": "91", "dpto": "AMAZONAS", "n_contratos": 11, "valor_total": 953903849.0, "score": 10.821128054800091, "tier": "bajo", "datos_insuficientes": false, "n_flags_aplicables": 2, "n_flags_disparados": 0, "banderas": []}, {"nit_entidad": "838000284", "nombre_entidad": "IED INEM JOSE EUSTASIO RIVERA", "cod_dpto": "91", "dpto": "AMAZONAS", "n_contratos": 6, "valor_total": 339720480.0, "score": 10.802503197519295, "tier": "bajo", "datos_insuficientes": true, "n_flags_aplicables": 1, "n_flags_disparados": 0, "banderas": []}, {"nit_entidad": "838000110", "nombre_entidad": "AMAZONAS - CONTRALORIA DEPARTAMENTAL DEL AMAZONAS", "cod_dpto": "91", "dpto": "AMAZONAS", "n_contratos": 81, "valor_total": 1892595597.0, "score": 9.238500455858604, "tier": "bajo", "datos_insuficientes": false, "n_flags_aplicables": 2, "n_flags_disparados": 1, "banderas": [{"flag_id": "F04", "nombre": "Abuso de contratación directa", "peso": 8, "evidence": {"nombre_entidad": "AMAZONAS - CONTRALORIA DEPARTAMENTAL DEL AMAZONAS", "cod_dpto": "91", "share_directa": 0.6800481032715834, "mean_share_peers": 0.14871099607963884, "sd_share_peers": 0.22999246487303862, "n_peers": 13, "n_contratos": 81, "z_score": 2.310237022266166}}]}, {"nit_entidad": "838000096", "nombre_entidad": "E.S.E. HOSPITAL SAN RAFAEL DE LETICIA", "cod_dpto": "91", "dpto": "AMAZONAS", "n_contratos": 11, "valor_total": 106416624626.0, "score": 8.634871201920081, "tier": "bajo", "datos_insuficientes": false, "n_flags_aplicables": 1, "n_flags_disparados": 0, "banderas": []}, {"nit_entidad": "838000047", "nombre_entidad": "ESCUELA NORMAL SUPERIOR DE LETICIA", "cod_dpto": "91", "dpto": "AMAZONAS", "n_contratos": 11, "valor_total": 689935725.0, "score": 8.076333863813327, "tier": "bajo", "datos_insuficientes": false, "n_flags_aplicables": 2, "n_flags_disparados": 0, "banderas": []}, {"nit_entidad": "8380000752", "nombre_entidad": "ESTABLECIMIENTO PENITENCIARIO DE MEDIANA SEGURIDAD Y CARCELARIO DE LETICIA", "cod_dpto": "91", "dpto": "AMAZONAS", "n_contratos": 85, "valor_total": 644747136.0, "score": 7.319845123072707, "tier": "bajo", "datos_insuficientes": false, "n_flags_aplicables": 2, "n_flags_disparados": 1, "banderas": [{"flag_id": "F12", "nombre": "Concentración/dependencia", "peso": 8, "evidence": {"anio": 2025, "doc_proveedor_dominante": "00000", "n_contratos_entidad_anual": 13, "participacion_proveedor_en_entidad": 0.5473740304642043, "condicion_a_captura_entidad": true, "n_contratos_proveedor_anual": 4, "dependencia_proveedor_en_entidad": 0.028786916766877058, "condicion_b_dependencia_proveedor": false}}]}, {"nit_entidad": "838000326", "nombre_entidad": "BATALLON DE APOYO Y SERVICIOS PARA EL COMBATE No. 26", "cod_dpto": "91", "dpto": "AMAZONAS", "n_contratos": 222, "valor_total": 10301959038.0, "score": 4.710658147372283, "tier": "bajo", "datos_insuficientes": false, "n_flags_aplicables": 2, "n_flags_disparados": 0, "banderas": []}], "serie_anio": [{"anio": 2017, "n_contratos": 10, "valor_total": 646960332.0, "score_promedio": 13.486923464973954}, {"anio": 2018, "n_contratos": 129, "valor_total": 4843529995.0, "score_promedio": 8.802170660311335}, {"anio": 2019, "n_contratos": 121, "valor_total": 4086999558.0, "score_promedio": 9.264385002653023}, {"anio": 2020, "n_contratos": 390, "valor_total": 31706802909.0, "score_promedio": 5.817601475721231}, {"anio": 2021, "n_contratos": 396, "valor_total": 40792624492.0, "score_promedio": 1.1704081014085266}, {"anio": 2022, "n_contratos": 418, "valor_total": 38304528295.0, "score_promedio": 2.131797602236516}, {"anio": 2023, "n_contratos": 680, "valor_total": 108487018797.0, "score_promedio": 10.483817578421395}, {"anio": 2024, "n_contratos": 4084, "valor_total": 281842058454.0, "score_promedio": 10.614642468889986}, {"anio": 2025, "n_contratos": 4379, "valor_total": 373547748395.0, "score_promedio": 7.517901046015228}, {"anio": 2026, "n_contratos": 2902, "valor_total": 131863340135.0, "score_promedio": 12.927752419656477}]}