{"cod_dpto": "94", "dpto": "GUAINÍA", "n_contratos": 2996, "valor_total": 219922266884.0, "score_promedio": 5.057946964157914, "n_bajo": 2911, "n_medio": 74, "n_alto": 11, "n_criticos": 0, "municipios": [{"cod_mpio": "94001", "municipio": "INÍRIDA", "n_contratos": 2996, "valor_total": 219922266884.0, "score": 5.057946964157915, "tier": "bajo", "datos_insuficientes": false}], "top_entidades": [{"nit_entidad": "843000047", "nombre_entidad": "DEPARTAMENTO DE POLICIA GUAINIA - DEGUN", "cod_dpto": "94", "dpto": "GUAINÍA", "n_contratos": 274, "valor_total": 20781845630.0, "score": 17.17359858124951, "tier": "bajo", "datos_insuficientes": false, "n_flags_aplicables": 2, "n_flags_disparados": 1, "banderas": [{"flag_id": "F12", "nombre": "Concentración/dependencia", "peso": 8, "evidence": {"anio": 2022, "doc_proveedor_dominante": "19017106", "n_contratos_entidad_anual": 38, "participacion_proveedor_en_entidad": 0.20688941141033657, "condicion_a_captura_entidad": false, "n_contratos_proveedor_anual": 5, "dependencia_proveedor_en_entidad": 0.8494079132539811, "condicion_b_dependencia_proveedor": true}}]}, {"nit_entidad": "8999990672", "nombre_entidad": "CONTRALORIA GENERAL DE LA REPÚBLICA-CGR- GERENCIA DEPARTAMENTAL GUANIA", "cod_dpto": "94", "dpto": "GUAINÍA", "n_contratos": 42, "valor_total": 1775437877.0, "score": 14.722364568405848, "tier": "bajo", "datos_insuficientes": false, "n_flags_aplicables": 2, "n_flags_disparados": 1, "banderas": [{"flag_id": "F12", "nombre": "Concentración/dependencia", "peso": 8, "evidence": {"anio": 2021, "doc_proveedor_dominante": "860011268", "n_contratos_entidad_anual": 5, "participacion_proveedor_en_entidad": 0.6532444352253576, "condicion_a_captura_entidad": true, "n_contratos_proveedor_anual": 2, "dependencia_proveedor_en_entidad": 0.2911101542835557, "condicion_b_dependencia_proveedor": false}}]}, {"nit_entidad": "892099105", "nombre_entidad": "MUNICIPIO DE INIRIDA", "cod_dpto": "94", "dpto": "GUAINÍA", "n_contratos": 1, "valor_total": 115000000.0, "score": 9.967862252064245, "tier": "bajo", "datos_insuficientes": true, "n_flags_aplicables": 0, "n_flags_disparados": 0, "banderas": []}, {"nit_entidad": "838000009", "nombre_entidad": "CORPORACION PARA EL DESARROLLO SOSTENIBLE DEL NORTE Y DEL ORIENTE AMAZONICO", "cod_dpto": "94", "dpto": "GUAINÍA", "n_contratos": 788, "valor_total": 34545592039.0, "score": 7.145889489872178, "tier": "bajo", "datos_insuficientes": false, "n_flags_aplicables": 2, "n_flags_disparados": 0, "banderas": []}, {"nit_entidad": "8920004959", "nombre_entidad": "CONTRALORIA DEPARTAMENTAL DEL GUAINIA", "cod_dpto": "94", "dpto": "GUAINÍA", "n_contratos": 42, "valor_total": 645720259.0, "score": 5.34729368423056, "tier": "bajo", "datos_insuficientes": false, "n_flags_aplicables": 2, "n_flags_disparados": 0, "banderas": []}, {"nit_entidad": "7180873", "nombre_entidad": "PERSONERIA MUNICIPAL DE INIRIDA", "cod_dpto": "94", "dpto": "GUAINÍA", "n_contratos": 20, "valor_total": 300718963.0, "score": 5.077563916281342, "tier": "bajo", "datos_insuficientes": false, "n_flags_aplicables": 2, "n_flags_disparados": 0, "banderas": []}], "serie_anio": [{"anio": 2018, "n_contratos": 20, "valor_total": 1358018885.0, "score_promedio": 13.43129349255794}, {"anio": 2019, "n_contratos": 32, "valor_total": 2791571507.0, "score_promedio": 14.86609677062755}, {"anio": 2020, "n_contratos": 211, "valor_total": 15164454980.0, "score_promedio": 3.5200408716718714}, {"anio": 2021, "n_contratos": 295, "valor_total": 23329546933.0, "score_promedio": 7.781370080679506}, {"anio": 2022, "n_contratos": 281, "valor_total": 23637439134.0, "score_promedio": 4.051127019276371}, {"anio": 2023, "n_contratos": 293, "valor_total": 30550008739.0, "score_promedio": 3.5257715140074977}, {"anio": 2024, "n_contratos": 640, "valor_total": 42732429173.0, "score_promedio": 1.0487747453168963}, {"anio": 2025, "n_contratos": 754, "valor_total": 60794147860.0, "score_promedio": 8.245979847271917}, {"anio": 2026, "n_contratos": 470, "valor_total": 19564649673.0, "score_promedio": 3.4810472743036702}]}