{"cod_dpto": "76", "dpto": "VALLE DEL CAUCA", "n_contratos": 16, "valor_total": 7400000000.0, "score_promedio": 42.351351351351354, "n_bajo": 5, "n_medio": 3, "n_alto": 4, "n_criticos": 4, "municipios": [{"cod_mpio": "76109", "municipio": "BUENAVENTURA", "n_contratos": 8, "valor_total": 3400000000.0, "score": 43.5, "tier": "alto", "datos_insuficientes": true}, {"cod_mpio": "76001", "municipio": "CALI", "n_contratos": 8, "valor_total": 4000000000.0, "score": 37.125, "tier": "medio", "datos_insuficientes": true}], "top_entidades": [{"nit_entidad": "900111005", "nombre_entidad": "ALCALDÍA DE BUENAVENTURA", "cod_dpto": "76", "dpto": "VALLE DEL CAUCA", "n_contratos": 3, "valor_total": 3400000000.0, "score": 43.5, "tier": "alto", "datos_insuficientes": true, "n_flags_aplicables": 5, "n_flags_disparados": 2, "banderas": []}, {"nit_entidad": "900111004", "nombre_entidad": "ALCALDÍA DE CALI", "cod_dpto": "76", "dpto": "VALLE DEL CAUCA", "n_contratos": 10, "valor_total": 4000000000.0, "score": 37.125, "tier": "medio", "datos_insuficientes": false, "n_flags_aplicables": 5, "n_flags_disparados": 2, "banderas": []}], "serie_anio": [{"anio": 2021, "n_contratos": 8, "valor_total": 4000000000.0, "score_promedio": 35.675}, {"anio": 2022, "n_contratos": 8, "valor_total": 3400000000.0, "score_promedio": 50.205882352941174}]}