{"cod_dpto": "97", "dpto": "VAUPÉS", "n_contratos": 796, "valor_total": 126139443607.0, "score_promedio": 7.509539406788054, "n_bajo": 772, "n_medio": 24, "n_alto": 0, "n_criticos": 0, "municipios": [{"cod_mpio": "97001", "municipio": "MITÚ", "n_contratos": 796, "valor_total": 126139443607.0, "score": 7.509539406788056, "tier": "bajo", "datos_insuficientes": false}], "top_entidades": [{"nit_entidad": "845000028", "nombre_entidad": "INSTITUTO DEPARTAMENTAL DE DEPORTES CULTURA Y RECREACIÓN DEL VAUPES", "cod_dpto": "97", "dpto": "VAUPÉS", "n_contratos": 2, "valor_total": 139988000.0, "score": 14.008718704380883, "tier": "bajo", "datos_insuficientes": true, "n_flags_aplicables": 0, "n_flags_disparados": 0, "banderas": []}], "serie_anio": [{"anio": 2018, "n_contratos": 8, "valor_total": 218830757.0, "score_promedio": 8.903021262864263}, {"anio": 2019, "n_contratos": 48, "valor_total": 2779152319.0, "score_promedio": 2.1601401915210516}, {"anio": 2020, "n_contratos": 67, "valor_total": 12352803480.0, "score_promedio": 2.5519609280256823}, {"anio": 2021, "n_contratos": 78, "valor_total": 10415375872.0, "score_promedio": 3.757522389578974}, {"anio": 2022, "n_contratos": 100, "valor_total": 48007276800.0, "score_promedio": 12.646709809700459}, {"anio": 2023, "n_contratos": 79, "valor_total": 10781482857.0, "score_promedio": 1.5217928632604578}, {"anio": 2024, "n_contratos": 163, "valor_total": 16322203068.0, "score_promedio": 4.687387393016923}, {"anio": 2025, "n_contratos": 159, "valor_total": 19744274701.0, "score_promedio": 7.0918741002037615}, {"anio": 2026, "n_contratos": 94, "valor_total": 5518043753.0, "score_promedio": 5.176462718635953}]}